{
  "$schema": "https://json-schema.org/draft/2020-12/schema",
  "$id": "https://cognitive-os.dev/schemas/cognitive-agent/v1/cognitive-agent.schema.json",
  "title": "Cognitive OS Developer Agent Manifest",
  "description": "Static manifest schema for developer agent submissions. Does NOT enable remote code execution. Package URL, entrypoint, and dependencies are metadata only. They are NOT downloaded, executed, or scanned at runtime in Step 23 MVP.",
  "type": "object",
  "additionalProperties": false,
  "required": [
    "name",
    "display_name",
    "description",
    "version",
    "capabilities",
    "required_permissions",
    "runtime_type",
    "security_profile"
  ],
  "properties": {
    "name": {
      "type": "string",
      "pattern": "^[a-z0-9_-]+$",
      "minLength": 2,
      "maxLength": 64,
      "description": "Technical name (lowercase, digits, dashes, underscores only)."
    },
    "display_name": {
      "type": "string",
      "minLength": 2,
      "maxLength": 120,
      "description": "Human-readable display name shown in Marketplace."
    },
    "description": {
      "type": "string",
      "minLength": 10,
      "maxLength": 2000,
      "description": "Short description of what this agent does."
    },
    "version": {
      "type": "string",
      "pattern": "^[0-9]+\\.[0-9]+\\.[0-9]+(-[a-zA-Z0-9.-]+)?$",
      "description": "Semver version string (e.g. 1.0.0, 1.0.0-beta.1)."
    },
    "capabilities": {
      "type": "array",
      "minItems": 1,
      "uniqueItems": true,
      "items": { "type": "string" },
      "description": "List of agent capabilities (e.g. knowledge search, meeting analysis)."
    },
    "required_permissions": {
      "type": "array",
      "minItems": 1,
      "uniqueItems": true,
      "items": { "type": "string" },
      "description": "Permissions this agent requires. Must be granted at install time. Examples: agent:execute, memory:read, kg:query."
    },
    "supported_workflows": {
      "type": "array",
      "items": { "type": "string" },
      "default": [],
      "description": "Workflows supported by this agent."
    },
    "runtime_type": {
      "type": "string",
      "enum": [
        "manifest_only"
      ],
      "description": "Runtime execution type. Step 23 MVP: only manifest_only is supported. Other types (simulation, http_webhook, sandboxed_process, container) are reserved for future steps."
    },
    "entrypoint": {
      "type": ["string", "null"],
      "default": null,
      "description": "Reserved. NOT executed by Step 23 runtime. For future sandbox support."
    },
    "config_schema": {
      "type": "object",
      "default": {},
      "description": "JSON Schema for agent configuration."
    },
    "usage_limits": {
      "type": "object",
      "default": {},
      "description": "Declared usage limits (e.g. max_calls_per_day)."
    },
    "security_profile": {
      "type": "object",
      "required": [
        "sandbox_level",
        "requires_network",
        "reads_user_data",
        "writes_user_data"
      ],
      "properties": {
        "sandbox_level": {
          "type": "string",
          "enum": ["no_execution", "simulation_only", "restricted", "isolated"],
          "description": "Sandbox isolation level. Step 23 MVP: only no_execution and simulation_only are allowed."
        },
        "requires_network": {
          "type": "boolean",
          "description": "Whether this agent requires network access. MVP: must be false."
        },
        "allowed_domains": {
          "type": "array",
          "items": { "type": "string" },
          "default": [],
          "description": "Domains this agent is allowed to contact (future)."
        },
        "reads_user_data": {
          "type": "boolean",
          "description": "Whether this agent reads user/enterprise data. MVP: warning if true."
        },
        "writes_user_data": {
          "type": "boolean",
          "description": "Whether this agent writes user/enterprise data. MVP: must be false."
        },
        "requires_secrets": {
          "type": "boolean",
          "default": false,
          "description": "Whether this agent requires secret injection. MVP: must be false."
        },
        "allowed_secret_names": {
          "type": "array",
          "items": { "type": "string" },
          "default": [],
          "description": "Allowed secret environment variable names (future)."
        },
        "data_access_scope": {
          "type": "array",
          "items": { "type": "string" },
          "default": [],
          "description": "Data access scope declarations."
        },
        "max_timeout_ms": {
          "type": "integer",
          "minimum": 0,
          "default": 0,
          "description": "Maximum execution timeout in ms."
        },
        "max_memory_mb": {
          "type": "integer",
          "minimum": 0,
          "default": 0,
          "description": "Maximum memory in MB."
        },
        "metadata": {
          "type": "object",
          "default": {},
          "description": "Additional security profile metadata."
        }
      },
      "additionalProperties": false
    },
    "metadata": {
      "type": "object",
      "properties": {
        "package_url": {
          "type": "string",
          "description": "Package URL for this agent. HTTPS only. NOT downloaded or executed by Step 23."
        },
        "repository_url": {
          "type": "string",
          "description": "Source repository URL."
        },
        "package_name": {
          "type": "string",
          "description": "Package name (should match manifest.name)."
        },
        "package_version": {
          "type": "string",
          "description": "Package version (should match manifest.version)."
        },
        "package_checksum": {
          "type": "string",
          "description": "SHA-256/384/512 checksum of the package. NOT verified by Step 23 (no download)."
        },
        "package_checksum_algorithm": {
          "type": "string",
          "enum": ["sha256", "sha384", "sha512"],
          "description": "Checksum algorithm."
        },
        "package_signature": {
          "type": "string",
          "description": "Package signature. NOT verified by Step 23."
        },
        "package_signature_algorithm": {
          "type": "string",
          "enum": ["minisign", "cosign", "gpg"],
          "description": "Signature algorithm."
        },
        "signing_key_id": {
          "type": "string",
          "description": "Signing key identifier."
        },
        "license": {
          "type": "string",
          "description": "Package license identifier (e.g. MIT, Apache-2.0)."
        },
        "security_contact": {
          "type": "string",
          "description": "Email or URL for security issues."
        },
        "dependencies": {
          "type": "array",
          "items": { "type": "string" },
          "description": "List of declared dependencies. NOT scanned for CVEs by Step 23."
        },
        "no_remote_code_execution": {
          "type": "boolean",
          "default": true,
          "description": "Declaration that this manifest does not involve remote code execution."
        },
        "simulation_only": {
          "type": "boolean",
          "default": true,
          "description": "Declaration that this agent only supports simulation mode."
        },
        "documentation_url": {
          "type": "string",
          "description": "URL to agent documentation."
        },
        "support_url": {
          "type": "string",
          "description": "URL to support contact."
        }
      }
    }
  }
}
